[
  {
    "organism_id": "ORG-001",
    "taxonomy_id": "TAX-001",
    "scientific_name": "Panthera tigris",
    "common_name": "Bengal Tiger",
    "kingdom": "Animalia",
    "habitat_type": "Terrestrial",
    "preferred_ecosystem": "ECO-001",
    "trophic_level": "Apex Predator",
    "functional_group": "Carnivore",
    "native_status": "Native",
    "environmental_sensitivity": "High",
    "conservation_status_reference": "Unknown",
    "is_synthetic": true,
    "source": "Synthetic demonstration data",
    "source_type": "Synthetic"
  },
  {
    "organism_id": "ORG-002",
    "taxonomy_id": "TAX-002",
    "scientific_name": "Elephas maximus",
    "common_name": "Asian Elephant",
    "kingdom": "Animalia",
    "habitat_type": "Terrestrial",
    "preferred_ecosystem": "ECO-001",
    "trophic_level": "Primary Consumer",
    "functional_group": "Herbivore",
    "native_status": "Native",
    "environmental_sensitivity": "High",
    "conservation_status_reference": "Unknown",
    "is_synthetic": true,
    "source": "Synthetic demonstration data",
    "source_type": "Synthetic"
  },
  {
    "organism_id": "ORG-003",
    "taxonomy_id": "TAX-003",
    "scientific_name": "Rhinoceros unicornis",
    "common_name": "Indian Rhinoceros",
    "kingdom": "Animalia",
    "habitat_type": "Terrestrial",
    "preferred_ecosystem": "ECO-011",
    "trophic_level": "Primary Consumer",
    "functional_group": "Herbivore",
    "native_status": "Native",
    "environmental_sensitivity": "High",
    "conservation_status_reference": "Unknown",
    "is_synthetic": true,
    "source": "Synthetic demonstration data",
    "source_type": "Synthetic"
  },
  {
    "organism_id": "ORG-004",
    "taxonomy_id": "TAX-004",
    "scientific_name": "Macaca silenus",
    "common_name": "Lion-tailed Macaque",
    "kingdom": "Animalia",
    "habitat_type": "Terrestrial",
    "preferred_ecosystem": "ECO-001",
    "trophic_level": "Primary Consumer",
    "functional_group": "Omnivore",
    "native_status": "Native",
    "environmental_sensitivity": "Very High",
    "conservation_status_reference": "Unknown",
    "is_synthetic": true,
    "source": "Synthetic demonstration data",
    "source_type": "Synthetic"
  },
  {
    "organism_id": "ORG-005",
    "taxonomy_id": "TAX-005",
    "scientific_name": "Nilgiritragus hylocrius",
    "common_name": "Nilgiri Tahr",
    "kingdom": "Animalia",
    "habitat_type": "Terrestrial",
    "preferred_ecosystem": "ECO-006",
    "trophic_level": "Primary Consumer",
    "functional_group": "Herbivore",
    "native_status": "Native",
    "environmental_sensitivity": "Very High",
    "conservation_status_reference": "Unknown",
    "is_synthetic": true,
    "source": "Synthetic demonstration data",
    "source_type": "Synthetic"
  },
  {
    "organism_id": "ORG-006",
    "taxonomy_id": "TAX-006",
    "scientific_name": "Ardeotis nigriceps",
    "common_name": "Great Indian Bustard",
    "kingdom": "Animalia",
    "habitat_type": "Terrestrial",
    "preferred_ecosystem": "ECO-003",
    "trophic_level": "Secondary Consumer",
    "functional_group": "Omnivore",
    "native_status": "Native",
    "environmental_sensitivity": "Very High",
    "conservation_status_reference": "Unknown",
    "is_synthetic": true,
    "source": "Synthetic demonstration data",
    "source_type": "Synthetic"
  },
  {
    "organism_id": "ORG-007",
    "taxonomy_id": "TAX-007",
    "scientific_name": "Prionailurus viverrinus",
    "common_name": "Fishing Cat",
    "kingdom": "Animalia",
    "habitat_type": "Transitional",
    "preferred_ecosystem": "ECO-018",
    "trophic_level": "Secondary Consumer",
    "functional_group": "Carnivore",
    "native_status": "Native",
    "environmental_sensitivity": "High",
    "conservation_status_reference": "Unknown",
    "is_synthetic": true,
    "source": "Synthetic demonstration data",
    "source_type": "Synthetic"
  },
  {
    "organism_id": "ORG-008",
    "taxonomy_id": "TAX-008",
    "scientific_name": "Lutrogale perspicillata",
    "common_name": "Smooth-coated Otter",
    "kingdom": "Animalia",
    "habitat_type": "Freshwater",
    "preferred_ecosystem": "ECO-008",
    "trophic_level": "Tertiary Consumer",
    "functional_group": "Predator",
    "native_status": "Native",
    "environmental_sensitivity": "High",
    "conservation_status_reference": "Unknown",
    "is_synthetic": true,
    "source": "Synthetic demonstration data",
    "source_type": "Synthetic"
  },
  {
    "organism_id": "ORG-009",
    "taxonomy_id": "TAX-009",
    "scientific_name": "Platanista gangetica",
    "common_name": "Ganges River Dolphin",
    "kingdom": "Animalia",
    "habitat_type": "Freshwater",
    "preferred_ecosystem": "ECO-008",
    "trophic_level": "Tertiary Consumer",
    "functional_group": "Predator",
    "native_status": "Native",
    "environmental_sensitivity": "Very High",
    "conservation_status_reference": "Unknown",
    "is_synthetic": true,
    "source": "Synthetic demonstration data",
    "source_type": "Synthetic"
  },
  {
    "organism_id": "ORG-010",
    "taxonomy_id": "TAX-010",
    "scientific_name": "Dugong dugon",
    "common_name": "Dugong",
    "kingdom": "Animalia",
    "habitat_type": "Marine",
    "preferred_ecosystem": "ECO-016",
    "trophic_level": "Primary Consumer",
    "functional_group": "Herbivore",
    "native_status": "Native",
    "environmental_sensitivity": "Very High",
    "conservation_status_reference": "Unknown",
    "is_synthetic": true,
    "source": "Synthetic demonstration data",
    "source_type": "Synthetic"
  },
  {
    "organism_id": "ORG-011",
    "taxonomy_id": "TAX-011",
    "scientific_name": "Gavialis gangeticus",
    "common_name": "Gharial",
    "kingdom": "Animalia",
    "habitat_type": "Freshwater",
    "preferred_ecosystem": "ECO-008",
    "trophic_level": "Tertiary Consumer",
    "functional_group": "Predator",
    "native_status": "Native",
    "environmental_sensitivity": "Very High",
    "conservation_status_reference": "Unknown",
    "is_synthetic": true,
    "source": "Synthetic demonstration data",
    "source_type": "Synthetic"
  },
  {
    "organism_id": "ORG-012",
    "taxonomy_id": "TAX-012",
    "scientific_name": "Crocodylus palustris",
    "common_name": "Mugger Crocodile",
    "kingdom": "Animalia",
    "habitat_type": "Freshwater",
    "preferred_ecosystem": "ECO-009",
    "trophic_level": "Tertiary Consumer",
    "functional_group": "Predator",
    "native_status": "Native",
    "environmental_sensitivity": "Moderate",
    "conservation_status_reference": "Unknown",
    "is_synthetic": true,
    "source": "Synthetic demonstration data",
    "source_type": "Synthetic"
  },
  {
    "organism_id": "ORG-013",
    "taxonomy_id": "TAX-013",
    "scientific_name": "Chelonia mydas",
    "common_name": "Green Sea Turtle",
    "kingdom": "Animalia",
    "habitat_type": "Marine",
    "preferred_ecosystem": "ECO-016",
    "trophic_level": "Primary Consumer",
    "functional_group": "Herbivore",
    "native_status": "Native",
    "environmental_sensitivity": "High",
    "conservation_status_reference": "Unknown",
    "is_synthetic": true,
    "source": "Synthetic demonstration data",
    "source_type": "Synthetic"
  },
  {
    "organism_id": "ORG-014",
    "taxonomy_id": "TAX-014",
    "scientific_name": "Batagur baska",
    "common_name": "Northern River Terrapin",
    "kingdom": "Animalia",
    "habitat_type": "Transitional",
    "preferred_ecosystem": "ECO-017",
    "trophic_level": "Primary Consumer",
    "functional_group": "Omnivore",
    "native_status": "Native",
    "environmental_sensitivity": "Very High",
    "conservation_status_reference": "Unknown",
    "is_synthetic": true,
    "source": "Synthetic demonstration data",
    "source_type": "Synthetic"
  },
  {
    "organism_id": "ORG-015",
    "taxonomy_id": "TAX-015",
    "scientific_name": "Tor putitora",
    "common_name": "Golden Mahseer",
    "kingdom": "Animalia",
    "habitat_type": "Freshwater",
    "preferred_ecosystem": "ECO-010",
    "trophic_level": "Secondary Consumer",
    "functional_group": "Omnivore",
    "native_status": "Native",
    "environmental_sensitivity": "High",
    "conservation_status_reference": "Unknown",
    "is_synthetic": true,
    "source": "Synthetic demonstration data",
    "source_type": "Synthetic"
  },
  {
    "organism_id": "ORG-016",
    "taxonomy_id": "TAX-016",
    "scientific_name": "Tenualosa ilisha",
    "common_name": "Hilsa Shad",
    "kingdom": "Animalia",
    "habitat_type": "Transitional",
    "preferred_ecosystem": "ECO-017",
    "trophic_level": "Filter Feeder",
    "functional_group": "Filter Feeder",
    "native_status": "Native",
    "environmental_sensitivity": "Moderate",
    "conservation_status_reference": "Unknown",
    "is_synthetic": true,
    "source": "Synthetic demonstration data",
    "source_type": "Synthetic"
  },
  {
    "organism_id": "ORG-017",
    "taxonomy_id": "TAX-017",
    "scientific_name": "Anguilla bengalensis",
    "common_name": "Indian Mottled Eel",
    "kingdom": "Animalia",
    "habitat_type": "Freshwater",
    "preferred_ecosystem": "ECO-008",
    "trophic_level": "Secondary Consumer",
    "functional_group": "Predator",
    "native_status": "Native",
    "environmental_sensitivity": "Moderate",
    "conservation_status_reference": "Unknown",
    "is_synthetic": true,
    "source": "Synthetic demonstration data",
    "source_type": "Synthetic"
  },
  {
    "organism_id": "ORG-018",
    "taxonomy_id": "TAX-018",
    "scientific_name": "Oreochromis mossambicus",
    "common_name": "Mozambique Tilapia",
    "kingdom": "Animalia",
    "habitat_type": "Freshwater",
    "preferred_ecosystem": "ECO-012",
    "trophic_level": "Primary Consumer",
    "functional_group": "Omnivore",
    "native_status": "Introduced",
    "environmental_sensitivity": "Low",
    "conservation_status_reference": "Unknown",
    "is_synthetic": true,
    "source": "Synthetic demonstration data",
    "source_type": "Synthetic"
  },
  {